{
  "id": "theming",
  "title": "Theming",
  "summary": "What a theme is. Modifiers such as light and dark are data, not generated colors.",
  "version": "0.1.0",
  "scope": "scoped",
  "order": 8,
  "questions": [
    {
      "id": "theme-shape",
      "prompt": "What is a theme?",
      "summary": "A theme can be one token set, or token sets plus modifiers.",
      "required": true,
      "options": [
        {
          "id": "sets-and-modifiers",
          "label": "Token sets plus modifiers",
          "summary": "Light and dark are modifiers.",
          "why": "A theme is a set of token sets plus modifiers, such as light and dark.",
          "when_to_choose": "Choose this if light and dark are modifiers on one theme.",
          "trade_offs": [
            "You maintain more than one set"
          ],
          "sources": [
            {
              "name": "Material",
              "title": "Color tokens",
              "url": "https://m3.material.io/styles/color/the-color-system/tokens"
            }
          ],
          "formula": "Theme = token sets + modifiers.",
          "recommends": [
            {
              "question": "default-theme",
              "options": [
                "light",
                "dark"
              ],
              "reason": "Token sets plus modifiers need a default set so one theme is in effect before a switch."
            }
          ]
        },
        {
          "id": "single-set",
          "label": "Single token set",
          "summary": "One appearance only.",
          "why": "One token set is the whole theme, with no light or dark modifier.",
          "when_to_choose": "Choose this if you ship a single appearance.",
          "trade_offs": [
            "Dark mode later means a new theme"
          ],
          "sources": [
            {
              "name": "DTCG",
              "title": "Design Tokens format",
              "url": "https://www.designtokens.org/tr/drafts/format/"
            }
          ]
        }
      ],
      "why_care": "It decides whether light and dark are modifiers on one theme, or whether you ship one look.",
      "affects": [
        "theme/tokens.css",
        "README.md",
        "AGENTS.md"
      ],
      "feeds_into": [
        "default-theme"
      ]
    },
    {
      "id": "default-theme",
      "prompt": "Which token set is in effect before a modifier?",
      "summary": "One set is the default. The other is a modifier.",
      "required": true,
      "why_care": "It decides whether light or dark is the set people see before they switch.",
      "affects": [
        "theme/tokens.css",
        "theme/tokens.json",
        "theme/tailwind.preset.cjs",
        "README.md",
        "AGENTS.md"
      ],
      "feeds_into": [],
      "options": [
        {
          "id": "light",
          "label": "Light",
          "summary": "Light is the default token set.",
          "why": "Light is the set in effect before someone switches to dark.",
          "when_to_choose": "Choose this if the page should open on the light set.",
          "trade_offs": [
            "Dark is a switch away"
          ],
          "sources": [
            {
              "name": "MDN",
              "title": "prefers-color-scheme",
              "url": "https://developer.mozilla.org/en-US/docs/Web/CSS/@media/prefers-color-scheme"
            },
            {
              "name": "Material",
              "title": "Color roles",
              "url": "https://m3.material.io/styles/color/roles"
            }
          ]
        },
        {
          "id": "dark",
          "label": "Dark",
          "summary": "Dark is the default token set.",
          "why": "Dark is the set in effect before someone switches to light.",
          "when_to_choose": "Choose this if the page should open on the dark set.",
          "trade_offs": [
            "Light is a switch away"
          ],
          "sources": [
            {
              "name": "MDN",
              "title": "prefers-color-scheme",
              "url": "https://developer.mozilla.org/en-US/docs/Web/CSS/@media/prefers-color-scheme"
            },
            {
              "name": "Material",
              "title": "Color roles",
              "url": "https://m3.material.io/styles/color/roles"
            }
          ],
          "fragment": "fragments/theme/dark-default.json"
        }
      ]
    }
  ]
}
