{
  "id": "spacing",
  "title": "Spacing",
  "summary": "Starter decisions for space.",
  "version": "0.1.0",
  "scope": "scoped",
  "order": 6,
  "questions": [
    {
      "id": "spacing-base",
      "prompt": "What is the spacing base?",
      "summary": "The smallest step the scale builds on.",
      "required": true,
      "options": [
        {
          "id": "base-4",
          "label": "4",
          "summary": "A four-pixel base.",
          "why": "A 4 px base builds a fine grid, and most steps are multiples of 4.",
          "when_to_choose": "Choose this if you want a fine grid.",
          "trade_offs": [
            "The scale has more steps to name"
          ],
          "sources": [
            {
              "name": "Material",
              "title": "Spacing",
              "url": "https://m3.material.io/foundations/layout/understanding-layout/spacing"
            }
          ],
          "formula": "Multiples of 4 pixels, recorded in the chosen unit.",
          "fragment": "spacing/base-4.css"
        },
        {
          "id": "base-8",
          "label": "8",
          "summary": "An eight-pixel base.",
          "why": "An 8 px base keeps the scale short and coarse.",
          "when_to_choose": "Choose this if you want fewer space tokens.",
          "trade_offs": [
            "Fine adjustments are harder"
          ],
          "sources": [
            {
              "name": "Material",
              "title": "Spacing",
              "url": "https://m3.material.io/foundations/layout/understanding-layout/spacing"
            }
          ],
          "formula": "Multiples of 8 pixels, recorded in the chosen unit.",
          "fragment": "spacing/base-8.css"
        }
      ],
      "why_care": "Every gap is a multiple of this number, so it sets how fine your layout grid is.",
      "affects": [
        "theme/tokens.css",
        "theme/tokens.json",
        "theme/tailwind.preset.cjs",
        "README.md",
        "AGENTS.md"
      ],
      "feeds_into": []
    },
    {
      "id": "spacing-scale",
      "prompt": "How does the spacing scale grow?",
      "summary": "Linear adds the base. Geometric multiplies it.",
      "required": true,
      "options": [
        {
          "id": "linear",
          "label": "Linear",
          "summary": "Add the base each step.",
          "why": "Linear space adds the same base amount each step.",
          "when_to_choose": "Choose this if gaps should be predictable.",
          "trade_offs": [
            "Large gaps grow slowly"
          ],
          "sources": [
            {
              "name": "Material",
              "title": "Spacing",
              "url": "https://m3.material.io/foundations/layout/understanding-layout/spacing"
            }
          ],
          "formula": "Each step adds the base."
        },
        {
          "id": "geometric",
          "label": "Geometric",
          "summary": "Multiply the base each step.",
          "why": "Geometric space multiplies the base each step, so large gaps grow fast.",
          "when_to_choose": "Choose this if page gaps should jump in size.",
          "trade_offs": [
            "Middle steps can feel missing"
          ],
          "sources": [
            {
              "name": "Material",
              "title": "Spacing",
              "url": "https://m3.material.io/foundations/layout/understanding-layout/spacing"
            }
          ],
          "formula": "Each step multiplies the base."
        }
      ],
      "why_care": "It decides whether gaps grow in even steps or jump in size as they get larger.",
      "affects": [
        "README.md",
        "AGENTS.md"
      ],
      "feeds_into": []
    },
    {
      "id": "css-unit",
      "prompt": "Which unit does space use?",
      "summary": "References the global unit.",
      "required": true,
      "ref": "global:css-unit",
      "why_care": "One answer covers type, spacing and radius, and it decides whether layout follows the reader's font size.",
      "affects": [
        "theme/tokens.css",
        "theme/tokens.json",
        "README.md",
        "AGENTS.md"
      ],
      "feeds_into": []
    }
  ]
}
