{
  "id": "delivery",
  "title": "Delivery",
  "summary": "What you share, and what is locked after init.",
  "version": "0.1.0",
  "scope": "scoped",
  "order": 9,
  "questions": [
    {
      "id": "shareable-item",
      "prompt": "What is the one shareable item?",
      "summary": "The item a team installs to start.",
      "required": true,
      "options": [
        {
          "id": "full-boilerplate",
          "label": "Full boilerplate",
          "summary": "Tokens, CSS, and components.",
          "why": "The shareable item is the full system: tokens, CSS and components.",
          "when_to_choose": "Choose this if a team should start from a full boilerplate.",
          "trade_offs": [
            "The package is heavier than tokens alone"
          ],
          "sources": [
            {
              "name": "shadcn/ui",
              "title": "Registry item",
              "url": "https://ui.shadcn.com/docs/registry/registry-item-json"
            }
          ]
        },
        {
          "id": "tokens-only",
          "label": "Tokens only",
          "summary": "The token file, without components.",
          "why": "The shareable item is the token file only, and components stay in the app.",
          "when_to_choose": "Choose this if each app owns its components.",
          "trade_offs": [
            "Teams rebuild the same components"
          ],
          "sources": [
            {
              "name": "DTCG",
              "title": "Design Tokens format",
              "url": "https://www.designtokens.org/tr/drafts/format/"
            }
          ]
        }
      ]
    },
    {
      "id": "locked-at-init",
      "prompt": "Which choices are locked after init?",
      "summary": "Locked fields must not drift after the boilerplate is installed.",
      "required": true,
      "options": [
        {
          "id": "lock-core",
          "label": "Lock tiers, pairing, and CSS variables",
          "summary": "Core names stay put.",
          "why": "Token tiers, the on-color pair and CSS variable names are locked after init.",
          "when_to_choose": "Choose this if those choices must not drift after setup.",
          "trade_offs": [
            "A later rename is a breaking change"
          ],
          "sources": [
            {
              "name": "shadcn/ui",
              "title": "components.json",
              "url": "https://ui.shadcn.com/docs/components-json"
            }
          ]
        },
        {
          "id": "lock-nothing",
          "label": "Lock nothing",
          "summary": "Every choice can still change.",
          "why": "Nothing is locked, so any choice can change after init.",
          "when_to_choose": "Choose this if you are still exploring the system.",
          "trade_offs": [
            "Installed files can drift apart"
          ],
          "sources": [
            {
              "name": "shadcn/ui",
              "title": "components.json",
              "url": "https://ui.shadcn.com/docs/components-json"
            }
          ]
        }
      ]
    },
    {
      "id": "token-tiers",
      "prompt": "How many token tiers do you use?",
      "summary": "Tiers are primitive, semantic, and component. This pack does not build them.",
      "required": true,
      "why_care": "Tiers decide whether components point at raw values or at named roles.",
      "affects": [
        "theme/tokens.json",
        "README.md",
        "AGENTS.md"
      ],
      "feeds_into": [],
      "options": [
        {
          "id": "flat",
          "label": "One flat layer",
          "summary": "One layer of tokens, with no aliases between them.",
          "why": "One layer holds every token, with no alias from a role name to a raw value.",
          "when_to_choose": "Choose this if you will not need role names that point at raw values.",
          "trade_offs": [
            "A brand change edits the same layer"
          ],
          "sources": [
            {
              "name": "DTCG",
              "title": "Design Tokens format",
              "url": "https://www.designtokens.org/tr/drafts/format/"
            },
            {
              "name": "Material",
              "title": "Design tokens overview",
              "url": "https://m3.material.io/foundations/design-tokens/overview"
            }
          ],
          "fragment": "fragments/tiers/flat.css"
        },
        {
          "id": "two-tier",
          "label": "Primitive and semantic",
          "summary": "Raw values, plus role names that point at them.",
          "why": "Raw values sit under role names, and components do not have their own tokens.",
          "when_to_choose": "Choose this if role names are enough and components can use them directly.",
          "trade_offs": [
            "Component tokens are not a separate layer"
          ],
          "sources": [
            {
              "name": "DTCG",
              "title": "Design Tokens format",
              "url": "https://www.designtokens.org/tr/drafts/format/"
            },
            {
              "name": "Material",
              "title": "Design tokens overview",
              "url": "https://m3.material.io/foundations/design-tokens/overview"
            }
          ],
          "fragment": "fragments/tiers/two-tier.css"
        },
        {
          "id": "three-tier",
          "label": "Primitive, semantic, component",
          "summary": "Raw values, role names, then component tokens that point at the roles.",
          "why": "Raw values, role names, and component tokens stay in three layers.",
          "when_to_choose": "Choose this if a brand change should not edit component files.",
          "trade_offs": [
            "You name and keep three layers"
          ],
          "sources": [
            {
              "name": "DTCG",
              "title": "Design Tokens format",
              "url": "https://www.designtokens.org/tr/drafts/format/"
            },
            {
              "name": "Material",
              "title": "Design tokens overview",
              "url": "https://m3.material.io/foundations/design-tokens/overview"
            }
          ],
          "formula": "primitive, semantic, and component.",
          "fragment": "fragments/tiers/three-tier.css"
        }
      ]
    }
  ]
}
